{
  "$schema": "schemas/capability-registry.schema.json",
  "schema_version": 2,
  "updated_at_utc": "2026-09-09T00:00:00Z",
  "purpose": "Machine-readable registry for generic external dataset import capabilities that Foundry may route without owning shared CLI, Rust tidas, SDK, converter, or database business logic.",
  "capabilities": [
    {
      "id": "foundry.task.route",
      "class": "task-router",
      "owner_project": "tiangong-lca-data-foundry",
      "entrypoint": "node scripts/foundry.ts route-task",
      "input_contract": "Task kind, dataset type, and required gate names.",
      "output_contract": "capability-route-plan.json when --out-dir is supplied, otherwise JSON on stdout.",
      "remote_write_mode": "read-only",
      "verification_gate": "status must be routed before autonomous adapter execution.",
      "source_manifest_requirements": ["task id", "kind", "dataset type", "capability registry"]
    },
    {
      "id": "foundry.final-delivery.promote",
      "class": "offline-final-delivery-promotion-gate",
      "owner_project": "tiangong-lca-data-foundry",
      "entrypoint": "node scripts/foundry.ts final-delivery-promote",
      "input_contract": "foundry-final-delivery-manifest.v1 plus content-bound local artifacts, declarative row/algebra/workbook/redaction policies, and independent reviewer reports.",
      "output_contract": "Immutable manifest snapshot, promotion ledger, reader-facing report, and a detached promotion seal only when every check passes with P0=P1=0.",
      "remote_write_mode": "read-only",
      "verification_gate": "Manifest/file SHA and byte bindings, row counts, algebra, exact workbook policy, redaction, reviewer coverage, and no-overwrite checks must all pass before the detached seal exists.",
      "source_manifest_requirements": [
        "final-delivery manifest",
        "artifact SHA/byte/schema/row descriptors",
        "declarative algebra",
        "workbook sheet and proof-column contract",
        "redaction policy",
        "independent reviewer reports"
      ]
    },
    {
      "id": "foundry.skill.tidas-import",
      "class": "import-orchestration",
      "owner_project": "tiangong-lca-skills",
      "entrypoint": "$foundry-tidas-import",
      "input_contract": "External LCA package, converted TIDAS rows, or source-document authoring task plus one Foundry workspace task directory.",
      "output_contract": "Ordered Foundry/Rust-tidas/CLI artifact chain from context, conversion or authoring, schema, QA, curation, AI semantic evidence (classification/location decision apply or patch collect/apply), post-authoring finalize report, mutation manifest, commit handoff, post-write remote verification, post-write closeout, task-level import completion report, and gated task completion.",
      "remote_write_mode": "orchestrates CLI-only task-policy-gated batch writes; no direct database access",
      "verification_gate": "The skill must not write database rows directly; commit remains blocked until the post-authoring finalize report and mutation manifest are ready_for_remote_write, the handoff plan is ready_for_explicit_commit, AI semantic evidence proves full schema/YAML/ruleset/context use, and task write policy permits the exact scope. A committed write scope is not closed until post-write verification and dataset-post-write-closeout pass for the exact final rows. A task is not complete until dataset-import-completion-report aggregates all required closeouts and task-complete moves the matching active task to done. Blocked scopes remain in the blocker ledger while independent ready scopes may continue.",
      "source_manifest_requirements": [
        "task directory",
        "source manifest",
        "profile lock",
        "account/write guard report",
        "write policy",
        "execution policy with max_parallelism",
        "lane selection",
        "current row files",
        "context pack paths",
        "gate reports",
        "AI full-context semantic evidence",
        "post-authoring finalize report",
        "mutation manifest",
        "commit handoff plan",
        "post-write verification report",
        "post-write closeout report",
        "task import completion report",
        "task-complete report"
      ]
    },
    {
      "id": "cli.dataset.contract-context",
      "class": "tidas-contract-context",
      "owner_project": "tiangong-lca-cli",
      "entrypoint": "tiangong-lca dataset context-pack",
      "input_contract": "Target TIDAS dataset type plus requested schema, methodology YAML, ruleset, and AI context artifacts.",
      "output_contract": "contract-report.json, contract-manifest.json, schema.json, methodology.yaml, runtime-ruleset.json, ai-context.json, and ai-context.md when available.",
      "remote_write_mode": "read-only",
      "verification_gate": "contract manifest must include artifact hashes before AI authoring consumes the context. For schema validation, the context assets must describe the same stable tidas contract advertised by `tidas validate --describe`; the executable handshake accepts compatible 0.2.x or 0.3.x releases rather than one patch.",
      "source_manifest_requirements": [
        "target TIDAS type",
        "CLI command record",
        "contract manifest",
        "schema hash",
        "methodology hash when available"
      ]
    },
    {
      "id": "tidas.dataset.import",
      "class": "external-lca-package-conversion",
      "owner_project": "tidas-tools",
      "entrypoint": "node scripts/foundry.ts dataset-tidas-import (thin adapter over `tidas import`)",
      "input_contract": "Supported external LCA source package, explicit output directory, optional source format, and optional native tidas config.",
      "output_contract": "Stable `tidas.operation-report.v1` import-report.json, issues.jsonl, process-bundles/index.json with one dependency subdirectory per converted process, mapping.csv when generated, and converted TIDAS/ILCD package outputs.",
      "remote_write_mode": "read-only",
      "verification_gate": "Foundry must complete the native 0.2.x handshake, preserve the Rust exit classification, require a complete operation report, and pass generated TIDAS rows through downstream schema/QA/curation gates.",
      "source_manifest_requirements": [
        "source package path",
        "native tidas version/contract handshake",
        "Rust command record",
        "operation report",
        "process-bundles/index.json",
        "mapping file when generated"
      ]
    },
    {
      "id": "cli.dataset.author",
      "class": "source-document-authoring",
      "owner_project": "tiangong-lca-cli",
      "entrypoint": "tiangong-lca dataset author",
      "input_contract": "PDF, Excel, image, markdown, or other source document plus target TIDAS types and an output directory.",
      "output_contract": "authoring-report.json, source-extract.json, and context/<type>/ contract context packs for each target type.",
      "remote_write_mode": "read-only",
      "verification_gate": "source extract and target contract manifests must exist before candidate row generation or repair begins.",
      "source_manifest_requirements": [
        "source file path",
        "author command record",
        "source extract",
        "target contract manifests"
      ]
    },
    {
      "id": "cli.dataset.evidence-search.plan",
      "class": "source-evidence-review",
      "owner_project": "tiangong-lca-cli",
      "entrypoint": "tiangong-lca dataset evidence-search plan",
      "input_contract": "Field-level evidence question, target field context, preferred domains, required terms, and search budget.",
      "output_contract": "evidence-search-plan.json.",
      "remote_write_mode": "read-only",
      "verification_gate": "plan must identify field scope, required evidence, source policy, and bounded query budget before public-source search runs.",
      "source_manifest_requirements": [
        "evidence question",
        "target field path when known",
        "search plan"
      ]
    },
    {
      "id": "cli.dataset.evidence-search.run",
      "class": "source-evidence-review",
      "owner_project": "tiangong-lca-cli",
      "entrypoint": "tiangong-lca dataset evidence-search run",
      "input_contract": "Evidence-search request plus normalized search results or a provider URL.",
      "output_contract": "evidence-search-report.json, evidence-search-results.jsonl, and evidence-search-declaration.json when evidence is absent or partial.",
      "remote_write_mode": "read-only",
      "verification_gate": "absence or partial evidence must block invented field values and create explicit review assumptions.",
      "source_manifest_requirements": [
        "evidence request",
        "search results source",
        "evidence report"
      ]
    },
    {
      "id": "external.document-granular-decompose",
      "class": "source-document-runtime-skill",
      "owner_project": "tiangong-ai/skills",
      "entrypoint": "pnpm dlx skills@latest use https://github.com/tiangong-ai/skills --skill document-granular-decompose --full-depth",
      "input_contract": "Local source document path, supported document file type, and UNSTRUCTURED_* environment variables for the MinerU fulltext extraction API.",
      "output_contract": "Runtime skill instructions and extracted fulltext captured as source evidence candidates, followed by Foundry evidence records under evidence/fulltext.txt and evidence/source-extract.json.",
      "remote_write_mode": "read-only",
      "verification_gate": "Before parsing, runtime-skill-resolution.json must record the pnpm dlx skills command, source repo, refs/heads/main commit from git ls-remote, skill name, evidence channel=document-fulltext, and timestamp. Extracted text is source evidence only; field values require downstream evidence capture, limitations, curation, and validation gates.",
      "source_manifest_requirements": [